{
  "label": {
    "item": {
      "NextDate": "Επόμενη ημερομηνία",
      "Repeat": "Επαναλαμβάνω"
    },
    "stats": {
      "PlannedTurnoverUntil": "Προγραμματισμένες εργασίες πριν {date}"
    }
  },
  "message": {
    "ConfirmDelete": "Είστε βέβαιοι ότι θέλετε να διαγράψετε αυτήν την προγραμματισμένη συναλλαγή;"
  },
  "page": {
    "title": "Προγραμματισμένες Συναλλαγές"
  },
  "when": {
    "quarter": "{date}-ος {quartMonth, select, 1{1. μήνας} 2{2. μήνας} 3{3. μήνας} other{}}"
  }
}
