{
  "label": {
    "item": {
      "NextDate": "Next date",
      "Repeat": "Repeat"
    },
    "stats": {
      "PlannedTurnoverUntil": "Planned operations until {date}"
    }
  },
  "message": {
    "ConfirmDelete": "Are you sure to delete this planned operation?"
  },
  "page": {
    "title": "Planned Transactions"
  },
  "when": {
    "quarter": "{date} of {quartMonth, select, 1{1st month} 2{2nd month} 3{3rd month} other{}}"
  }
}
