{
  "label": {
    "item": {
      "NextDate": "След. дата",
      "Repeat": "Повтор"
    },
    "stats": {
      "PlannedTurnoverUntil": "Запланированные операции до {date}"
    }
  },
  "message": {
    "ConfirmDelete": "Вы уверены, что хотите удалить эту плановую транзакцию?"
  },
  "page": {
    "title": "Плановые транзакции"
  },
  "when": {
    "quarter": "{date}-го {quartMonth, select, 1{в 1-й месяц} 2{во 2-й месяц} 3{в 3-й месяц} other{}}"
  }
}
