{
  "label": {
    "item": {
      "NextDate": "Příští datum",
      "Repeat": "Opakovat"
    },
    "stats": {
      "PlannedTurnoverUntil": "Plánované operace {date}"
    }
  },
  "message": {
    "ConfirmDelete": "Opravdu chcete tuto naplánovanou transakci smazat?"
  },
  "page": {
    "title": "Plánované transakce"
  },
  "when": {
    "quarter": "{date}-ého {quartMonth, select, 1{1. měsic} 2{2. měsic} 3{3. měsic} other{}}"
  }
}
