{
  "label": {
    "item": {
      "NextDate": "próxima fecha",
      "Repeat": "Repetir"
    },
    "stats": {
      "PlannedTurnoverUntil": "Operaciones planificadas hasta {date}"
    }
  },
  "message": {
    "ConfirmDelete": "¿Está seguro de eliminar esta operación planificada?"
  },
  "page": {
    "title": "Transacciones planificadas"
  },
  "when": {
    "quarter": "{date} de {quartMonth, select, 1{1er. mes} 2{2do. mes} 3{3er. mes} other{}}"
  }
}